attrs :
{
  bcdUSB = 0x0200;
  bDeviceClass = 0xEF;
  bDeviceSubClass = 0x02;
  bDeviceProtocol = 0x01;
  bMaxPacketSize0 = 0x40;
  idVendor = 0x1209;
  idProduct = 0x0071;
  bcdDevice = 0x0100;
};
os_descs :
{
  use = 1;
  qw_sign = "MSFT100";
  b_vendor_code = 0xCD;
};
strings = (
  {
    lang = 0x409;
    manufacturer = "Nerves Project";
    product = "Ethernet + HID Gadget";
    serialnumber = "";
  } );
functions :
{
  rndis_usb0 :
  {
    instance = "usb0";
    type = "rndis";
    os_descs = (
      {
        interface = "rndis";
        compatible_id = "RNDIS";
        sub_compatible_id = "5162001";
      } );
  };
  ncm_usb1 :
  {
    instance = "usb1";
    type = "ncm";
  };
  hid_usb2 :
  {
    instance = "usb2";
    type = "hid";
    attrs :
    {
      protocol = 1;
      report_length = 8;
      subclass = 1;
      report_desc = (
          # 6-key-rollover descriptor
          0x05, 0x01, 0x09, 0x06, 0xA1, 0x01, 0x05, 0x07,
          0x19, 0xE0, 0x29, 0xE7, 0x15, 0x00, 0x25, 0x01,
          0x75, 0x01, 0x95, 0x08, 0x81, 0x02, 0x81, 0x01,
          0x19, 0x00, 0x29, 0xFF, 0x15, 0x00, 0x25, 0xFF,
          0x75, 0x08, 0x95, 0x06, 0x81, 0x00, 0x05, 0x08,
          0x19, 0x01, 0x29, 0x05, 0x15, 0x00, 0x25, 0x01,
          0x75, 0x01, 0x95, 0x05, 0x91, 0x02, 0x95, 0x03,
          0x91, 0x01, 0xC0
        );
    };
  };
};
configs = (
  {
    id = 1;
    name = "c";
    attrs :
    {
      bmAttributes = 0xC0;
      MaxPower = 250;
    };
    strings = (
      {
        lang = 0x409;
        configuration = "NCM and RNDIS Ethernet with HID Keyboard";
      } );
    functions = (
      {
        name = "rndis.usb0";
        function = "rndis_usb0";
      },
      {
        name = "ncm.usb1";
        function = "ncm_usb1";
      },
      {
        name = "hid.usb2";
        function = "hid_usb2";
      } );
  } );
